A1: Instructions: Input data into the required fields for your material and punch & die configuration. This estimates the tonnage required to complete a 90° bend. (Yield and Tensile Material chart below)
A2: Tensile Strength (PSI) | B2: (required)
A3: Material Thickness (inches) - T | B3: (required)
A4: Die Width (inches) - W | B4: (required)
A5: Punch Radius (inches) | B5: (required)
A7: K Factor
A8: Die Ratio (W/T)
A9: Bend Radius - Inside Estimated Air Bend Radius
A10: Bend Radius - Outside Estimated Air Bend Radius
A11: Minimum Between Bends Minimum Leg Length for Die Width
A12: Tonnage Required (per foot of Bend)
A13: Total Tonnage for Bend
A14: Overall Length | B14: FT (required)
A15: TONS
A16: Constants (Press Brake Tonnage):
A17: Bend Length (inches)
A18: Friction Coefficient
A19: Calculated Value of Force
A20: Bend Angle (degrees)
A21: DISCLAIMER: Actual bending force is affected by many factors such as friction between the material and the die, material thickness, material strength variations, rolling direction of the steel, work hardening and other parameters. This estimator calculates a force representative of the pressbrake requirement for air bending. Sizing of a machine or available die width should allow for up to 20% additional capacity. We make no guarantee of actual force required to make a bend in a specific part.

A2: MATERIAL STRENGTH
A3: ASTM Number | B3: Other Number | C3: Grade | D3: Yield Str. | E3: Min. Tensile | F3: Max. Tensile | G3: Min. Rad. | H3: Recom. Vee Die
A4: CARBON STEEL
B5: 1015 | D5: 29000 | E5: 50000 | F5: =E4+15000 -> 65000
B6: 1020 | D6: 32000 | E6: 58000 | F6: =E5+15000 -> 73000
B7: 1025 | D7: 34000 | E7: 70000 | F7: =E6+15000 -> 85000
A8: A36 | D8: 36000 | E8: 58000 | F8: 80000 | G8: 1.5T | H8: 8T - 12T
A9: A242 | B9: CORTEN | C9: A | D9: 50000 | E9: 70000 | F9: =E8+15000 -> 85000 | G9: 3T | H9: 12T
A10: A283 | D10: 30000 | E10: 55000 | F10: 60000 | G10: 1.5T | H10: 8T - 10T
A11: A514 | B11: T-1 | C11: B,F,H,Q | D11: 100000 | E11: 110000 | F11: 130000 | G11: 3T | H11: 16T
A12: A570 | C12: 30 | D12: 30000 | E12: 49000 | F12: =E12+15000 -> 64000 | G12: 1T | H12: 8T
C13: 33 | D13: 33000 | E13: 52000 | F13: =E13+15000 -> 67000 | G13: 1T | H13: 10T
C14: 36 | D14: 36000 | E14: 53000 | F14: =E14+15000 -> 68000 | G14: 1.5T
C15: 40 | D15: 40000 | E15: 55000 | F15: =E15+15000 -> 70000 | G15: 2T | H15: 12T
C16: 45 | D16: 45000 | E16: 60000 | F16: =E16+15000 -> 75000 | G16: 2T
C17: 50 | D17: 50000 | E17: 65000 | F17: =E17+15000 -> 80000 | G17: 2.5T
C18: 55 | D18: 55000 | E18: 70000 | F18: =E18+15000 -> 85000 | G18: 3T
A19: A572 | C19: 42 | D19: 42000 | E19: 60000 | F19: =E19+15000 -> 75000 | G19: 2T | H19: 10T - 12T
C20: 50 | D20: 50000 | E20: 70000 | F20: =E20+15000 -> 85000 | G20: 2.5T | H20: 12T
C21: 60 | D21: 60000 | E21: 75000 | F21: =E21+15000 -> 90000 | G21: 3.5T | H21: 14T
C22: 65 | D22: 65000 | E22: 80000 | F22: =E22+15000 -> 95000 | G22: 4T | H22: 14T - 16T
A23: A588 | B23: CORTEN | C23: B | D23: 50000 | E23: 70000 | F23: =E23+15000 -> 85000 | G23: 3T | H23: 10T - 12T
A24: A606 | D24: 50000 | E24: 70000 | F24: =E24+15000 -> 85000 | G24: 2.5T | H24: 8T - 12T
A25: A607 | C25: 45 | D25: 45000 | E25: 60000 | F25: =E25+15000 -> 75000 | G25: 1.5T | H25: 8T - 10T
C26: 50 | D26: 50000 | E26: 65000 | F26: =E26+15000 -> 80000 | G26: 2T | H26: 10T - 12T
C27: 55 | D27: 55000 | E27: 70000 | F27: =E27+15000 -> 85000 | G27: 2T | H27: 12T
C28: 60 | D28: 60000 | E28: 75000 | F28: =E28+15000 -> 90000 | G28: 2.5T | H28: 12T - 14T
C29: 65 | D29: 65000 | E29: 80000 | F29: =E29+15000 -> 95000 | G29: 3T | H29: 14T
C30: 70 | D30: 70000 | E30: 85000 | F30: =E30+15000 -> 100000 | G30: 3.5T | H30: 16T
A31: A611 | C31: A | D31: 25000 | E31: 52000 | F31: =E31+15000 -> 67000 | G31: .5T
C32: B | D32: 30000 | E32: 45000 | F32: =E32+15000 -> 60000 | G32: 1T
C33: C | D33: 33000 | E33: 48000 | F33: =E33+15000 -> 63000 | G33: 1.5T
C34: D | D34: 40000 | E34: 52000 | F34: =E34+15000 -> 67000 | G34: 2T
C35: E | D35: 80000 | E35: 82000 | F35: =E35+15000 -> 97000 | G35: NA
A36: A656 | C36: 50 | D36: 50000 | E36: 60000 | F36: =E36+15000 -> 75000 | G36: 1.5T | H36: 8T - 10T
C37: 60 | D37: 60000 | E37: 70000 | F37: =E37+15000 -> 85000 | H37: 8T - 10T
C38: 70 | D38: 70000 | E38: 80000 | F38: =E38+15000 -> 95000 | H38: 8T - 10T
C39: 80 | D39: 80000 | E39: 95000 | F39: =E39+15000 -> 110000 | G39: 1.5T | H39: 8T - 10T
A40: A715 | B40: A606 | C40: 50 | D40: 50000 | E40: 60000 | F40: =E40+15000 -> 75000 | G40: 1T | H40: 10T
B41: A607 | C41: 60 | D41: 60000 | E41: 70000 | F41: =E41+15000 -> 85000 | G41: 1.5T | H41: 8T - 10T
B42: A607 | C42: 70 | D42: 70000 | E42: 80000 | F42: =E42+15000 -> 95000 | G42: 2T | H42: 10T
C43: 80 | D43: 80000 | E43: 90000 | F43: =E43+15000 -> 105000 | G43: 2T | H43: 10T - 12T
A44: A907 | C44: 30 | D44: 30000 | E44: 49000 | F44: =E44+15000 -> 64000
C45: 33 | D45: 33000 | E45: 52000 | F45: =E45+15000 -> 67000
C46: 36 | D46: 36000 | E46: 53000 | F46: =E46+15000 -> 68000
C47: 40 | D47: 40000 | E47: 55000 | F47: =E47+15000 -> 70000
B48: AR360 | E48: 177000 | F48: =E48+15000 -> 192000
B49: AR (235) | D49: 70000 | E49: 115000 | F49: =E49+15000 -> 130000
B50: WELDEX | C50: 130 | D50: 130000 | E50: 147000 | F50: 160000 | G50: 4T
C51: 160 | D51: 160000 | E51: 181000 | F51: 225000 | G51: 6T
A52: ASTM Number | B52: Other Number | C52: Grade | D52: Yield Str. | E52: Min. Tensile | F52: Max. Tensile | G52: Min. Rad. | H52: Recom. Vee Die
A53: STAINLESS STEEL
A54: A167 | B54: S30215 | C54: 302B | D54: 30000 | E54: 75000 | F54: =E54+15000 -> 90000
B55: S30800 | C55: 308 | D55: 30000 | E55: 75000 | F55: =E55+15000 -> 90000
B56: S30900 | C56: 309 | D56: 30000 | E56: 75000 | F56: =E56+15000 -> 90000
B57: S31000 | C57: 310 | D57: 30000 | E57: 75000 | F57: =E57+15000 -> 90000
B58: S33228 | D58: 27000 | E58: 73000 | F58: =E58+15000 -> 88000
B59: S35315 | D59: 39000 | E59: 94000 | F59: =E59+15000 -> 109000
A60: A176 | B60: S32803 | D60: 72000 | E60: 87000 | F60: =E60+15000 -> 102000
B61: S40300 | C61: 403 | D61: 30000 | E61: 70000 | F61: =E61+15000 -> 85000
B62: S42000 | C62: 420 | E62: 100000 | F62: =E62+15000 -> 115000
B63: S44200 | C63: 442 | D63: 40000 | E63: 65000 | F63: =E63+15000 -> 80000
B64: S44600 | C64: 446 | D64: 40000 | E64: 65000 | F64: =E64+15000 -> 80000
A65: A666
A66: A693 | C66: 630 | D66: 160000 | E66: 185000 | F66: =E66+15000 -> 200000
C67: 631 | D67: 55000 | E67: 150000 | F67: =E67+15000 -> 165000
C68: 632 | D68: 65000 | E68: 150000 | F68: =E68+15000 -> 165000
C69: 635 | D69: 75000 | E69: 120000 | F69: =E69+15000 -> 135000
A70: A887
A71: ASTM Number | B71: Other Number | C71: Grade | D71: Yield Str. | E71: Min. Tensile | F71: Max. Tensile | G71: Min. Rad. | H71: Recom. Vee Die
A73: B209 | B73: 1100 | E73: 14000 | F73: 24000
B74: 3003 | E74: 17000 | F74: 30000
B75: 5005 | E75: 18000 | F75: 30000
B76: 5052 | E76: 31000 | F76: 44000
B77: 5083 | E77: 40000 | F77: 59000
B78: 5086 | E78: 40000 | F78: 54000
B79: 5454 | E79: 36000 | F79: 47000
B80: 2024 | E80: 30000 | F80: 63000
B81: 6061 | E81: 20000 | F81: 42000
A82: B221 | B82: 6063 | E82: 13000 | F82: 35000
B83: 7075 | E83: 33000 | F83: 83000